date,text
2025-12-01,"Prediction: The Data Center Boom Is Just Starting, Making AMD a Long-Term AI Power Player(Motley Fool)"
2025-12-01,Apple AI chief leaving as iPhone maker plays catch-up(AFP)
2025-12-01,Google CTO reveals strategy behind Gemini's comeback(DigiTimes)
2025-12-01,"Samsung, SK Hynix lead HBM market, capitalize on Google's TPU push(DigiTimes)"
2025-12-01,"MediaTek secures Google V7e chip order, eyes 2M units by 2027(DigiTimes)"
2025-12-01,Better $3 Trillion AI Stock to Buy Now: Microsoft or Alphabet(Motley Fool)
2025-12-01,Black Friday Investing Lessons(Motley Fool)
2025-12-01,Siri-us setback: Apples AI chief steps down as company lags behind rivals(The Guardian)
2025-12-01,Apple AI chief Giannandrea to step down as company reshuffles leadership(Investing.com)
2025-12-01,"Apple names Amar Subramanya new VP of AI, replacing John Giannandrea(Reuters)"
2025-12-01,Apple's AI chief abruptly steps down(NBC News)
2025-12-01,"Runway's New Video Model Challenges Rivals Google, OpenAI(Bloomberg)"
2025-12-01,Trillion-Dollar Companies Now Go To 11; Google Is No. 3(Investor's Business Daily)
2025-12-01,Stocks To Watch As Google Drives Rattled But Rebounding Market(Investor's Business Daily)
2025-12-01,Nvidia Stock Rises After Synopsys Deal. Heres the Goodand the Bad.(Barrons.com)
2025-12-01,Salesforce CEO Marc Benioff Just Said Gemini 3 Changed the World. Does That Make GOOGL Stock a Buy?(Barchart)
2025-12-01,"Competition Is Heating Up, But Bank of America Still Thinks AMD Stock Is a Buy Here(Barchart)"
2025-12-01,Amazon and Google Launches Game-Changing Cloud Alliance(GuruFocus.com)
2025-12-01,Amazon And Google Unveil New Multicloud Link(GuruFocus.com)
2025-12-01,AI: Late 2026 will be inflection point for these hyperscalers(Yahoo Finance Video)
2025-12-01,What Are the 5 Top Artificial Intelligence (AI) Stocks to Buy Right Now?(Motley Fool)
2025-12-01,Why AI Stocks Wobbles Arent a Reason to Worry(Barrons.com)
2025-12-01,"Alphabet Poised for Revenue Boost as TPU Production Outlook Rises, Morgan Stanley Says(GuruFocus.com)"
2025-12-01,Wall Street Continues to Underestimate the Growth of Magnificent Seven Companies. Here's Why.(Investopedia)
2025-12-01,China's DeepSeek Fires AI Warning Shot(GuruFocus.com)
2025-12-01,Alphabet Stock Climbs 31% as Retail Traders Bet on TPU Price War With NVIDIA(24/7 Wall St.)
2025-12-01,"Nvidia Buys $2B of Synopsys Stock, DeepSeek Debuts New AI Models(Bloomberg)"
2025-12-01,Construction workers are cashing in on the AI boom(TechCrunch)
2025-12-01,YouTube TV finally delivers the improvement subscribers wanted(TheStreet)
2025-12-01,"AMD Stock Drops 15% in a Month: Should You Buy, Sell, or Hold?(Barchart)"
2025-12-01,Is This Trillion-Dollar Giant a Threat to Nvidia and AMD?(Motley Fool)
2025-12-01,Google Faces New Rival In TaiwanGMI Cloud Announces Nvidia-Powered $500 Million AI Data Center With 2M Tokens Per Second(Benzinga)
2025-12-01,This Week Is Crucial for AI Stock Investors(Motley Fool)
2025-12-01,Amazon Teams With Google On 'Multicloud' Service. How Stocks Are Reacting.(Investor's Business Daily)
2025-12-01,Cathie Wood Is Buying GOOGL Stock as Alphabet Approaches $4 Trillion. Should You?(Barchart)
2025-12-01,"After Eliminating 25% Of Its Staff, The IRS Is Turning To AI Agents. 'It Would Be Negligence' Not To Use AI Tools(Benzinga)"
2025-12-01,Alphabets Best Day Ever(24/7 Wall St.)
2025-12-01,Berkshires Alphabet Bet Has Done MagnificentlyIs it Too Late to Follow?(24/7 Wall St.)
2025-12-01,"Wall Street is Still Pounding the Table Over Nvidia, Alphabet and Wynn(24/7 Wall St.)"
2025-12-01,Bitcoin ATM Scams Cost Americans Nearly $250M In 2024. Here's How To Avoid Falling Victim To Similar Scams(Benzinga)
2025-12-01,"Alphabet and Nvidia alone make up a third of the S&P 500's gains this year, in a sign of Big Tech's dominance(MarketWatch)"
2025-12-01,Is Meta Platforms Stock a Buy Below $650?(24/7 Wall St.)
2025-12-01,Wall Street lifts Broadcom targets on rising TPU leverage(Investing.com)
2025-12-01,"Alphabet could see billions in added revenue from TPU sales, Morgan Stanley says(Investing.com)"
2025-12-01,ChatGPT Turns Three. 5 Stocks That Have Soared in the AI Era and What Comes Next.(Barrons.com)
2025-12-01,Nvidia Stock Slips Again. The Chip Maker Is Down More Than 14% Over the Past Month.(Barrons.com)
2025-12-01,These are the top 10 most popular stocks on Robinhood UK in November(Investing.com)
2025-12-01,The 6 Best Growth Stocks to Buy in December(Motley Fool)
